{
  "id": "brewery:whiskey",
  "display_name": "Whiskey",
  "flavor_intent": "Grain spirit with barrel aging",
  "ingredients": {
    "fermentables": ["minecraft:wheat_seeds"],
    "botanicals": [],
    "modifiers": ["minecraft:redstone", "minecraft:glowstone_dust"]
  },
  "processing": {
    "stages": ["mash", "ferment", "distill", "age"],
    "metadata_rules": {
      "base_strength": 2.5,
      "strength_per_distill": 1.5,
      "aging_effect": 0.8,
      "clarity_modifiers": {},
      "flavor_profile": {
        "grain": 3,
        "oak": 3,
        "smoke": 1
      }
    }
  }
}
